{
  "status": "draft",
  "title": "TPC-H SF1 Unified Supply Chain Analytics",
  "description": "Unified explore combining orders, line item shipments, receipt milestones, and supplier inventory across shared customer and geography dimensions.",
  "bigquery": {
    "dataset": "bigquery-public-data.tpch_sf1",
    "location": "US"
  },
  "architecturePrompt": "You are tasked with building a LookML exploration model for our wholesale supply chain and commerce data in BigQuery (dataset: `bigquery-public-data.tpch_sf1`).\n\nOur business teams (Executive, Logistics, and Procurement) need a unified Explore where they can build combined reports and dashboards without hopping between separate disconnected explores. For example, our analysts need to:\n- Compare overall order sales volume against line-item shipping discounts grouped by customer nation and date.\n- Compare supplier parts inventory availability against total order demand grouped by geographic region.\n- Track order placements, shipping milestones, and delivery receipts side-by-side along a unified event timeline.\n\nPlease inspect the underlying dataset tables in BigQuery. Ensure that your LookML explore model enables these combined queries accurately and performantly—avoiding fanout errors, duplicated sums, or slow query performance when metrics from different tables (like orders, lineitem events, and part-supplier inventory) are queried together alongside common dimensions (customer, nation, region, date).",
  "userQuestions": {
    "ordersVsShipmentsByNation": {
      "supported": true,
      "prompt": "Create a query for an executive dashboard showing total order revenue vs total shipped discount amount grouped by customer nation.",
      "expectation": {
        "participatingColumns": [
          "orders.o_totalprice",
          "lineitem.l_discount",
          "customer.c_nationkey",
          "nation.n_name"
        ]
      }
    },
    "inventoryVsOrderDemandByRegion": {
      "supported": true,
      "prompt": "Create a query comparing total part supply availability cost against total ordered price grouped by region.",
      "expectation": {
        "participatingColumns": [
          "partsupp.ps_supplycost",
          "orders.o_totalprice",
          "region.r_name"
        ]
      }
    },
    "unsupportedIntradayStock": {
      "supported": false,
      "prompt": "Show intra-day real-time stock ticks by minute for supplier inventory.",
      "expectation": {
        "participatingColumns": []
      }
    }
  }
}
